{
  "month": "2026-10",
  "spent": 1514.37,
  "cap": 3100,
  "costPerSignup": 252.4,
  "recommendations": [
    {
      "kind": "stop",
      "channel": "X",
      "title": "Keep X spend paused until phone sign-in returns people",
      "detail": "All 5 recent campaigns are paused or expired. 6 outside installs reached the app in 28 days, about $252 each, and all 6 phone sign-ins in the last 48 hours never came back"
    }
  ],
  "posts": [
    {
      "title": "Ad 1 stop pasting, paid copy",
      "channel": "X",
      "date": "2026-10-25",
      "views": 2763020,
      "clicks": 4748,
      "spend": 206.24,
      "status": "boosting"
    },
    {
      "title": "Grok works inside Rooms, 90 s demo",
      "channel": "X",
      "date": "2026-10-26",
      "views": 337795,
      "clicks": 1739,
      "spend": 78.29,
      "status": "boosting"
    },
    {
      "title": "Free DeepSeek, Android quick promote",
      "channel": "X",
      "date": "2026-10-16",
      "views": 1882138,
      "clicks": 320,
      "spend": 277.61,
      "status": "stopped"
    },
    {
      "title": "Stop pasting 9 pages, organic post",
      "channel": "X",
      "date": "2026-10-25",
      "views": 268863,
      "clicks": 114,
      "spend": 35.89,
      "status": "stopped"
    },
    {
      "title": "Subscriptions walkthrough",
      "channel": "X",
      "date": "2026-10-27",
      "views": 31652,
      "clicks": 146,
      "spend": 6.38,
      "status": "boosting"
    },
    {
      "title": "2am, 4 monitors",
      "channel": "X",
      "date": "2026-10-28",
      "views": 3319,
      "clicks": 0,
      "spend": 0.97,
      "status": "boosting"
    }
  ]
}
